PK;NOMBRE;DESCRIPCION-ENTIDAD;HORARIO;EQUIPAMIENTO;TRANSPORTE;DESCRIPCION;ACCESIBILIDAD;CONTENT-URL;NOMBRE-VIA;CLASE-VIAL;TIPO-NUM;NUM;PLANTA;PUERTA;ESCALERAS;ORIENTACION;LOCALIDAD;PROVINCIA;CODIGO-POSTAL;BARRIO;DISTRITO;COORDENADA-X;COORDENADA-Y;LATITUD;LONGITUD;TELEFONO;FAX;EMAIL;TIPO;
13947;"Banco de Espana";"El Banco de Espana es el banco central nacional y el supervisor del sistema bancario espanol. Su actividad esta regulada por la Ley de Autonomia del Banco de Espana.";"De lunes a viernes: 8.30 a 14.00 h   Sabados, domingos y festivos: cerrado  Festivos 2017: 6 de enero; 20 de marzo; 13 y 14 de abril; 1, 2 y 15 de mayo; 15 de agosto; 12 de octubre; 1 y 9 de noviembre; 6, 8 y 25 de diciembre.";"Algunos servicios se encuentran ubicados en:   C/  Alcala, 522  28027 Madrid";"Metro: Banco de Espana (linea 2)  Bus: 1, 2, 9, 10, 15, 20, 34, 51, 52, 53, 74, 146, 202, 203";"Dispone de helipuerto civil";"0";"http://www.madrid.es/sites/v/index.jsp?vgnextchannel=9e4c43db40317010VgnVCM100000dc0ca8c0RCRD&vgnextoid=487d995a8bf5d010VgnVCM2000000c205a0aRCRD";"ALCALA";"CALLE";"V";"48";"";"";"";"";"MADRID";"MADRID";"28014";"CORTES";"CENTRO";"441164";"4474685";"40.4188339187439";"-3.69482107480432";"913 385 000 (centralita)";"";"";"/contenido/entidadesYorganismos/MonumentosEdificiosArtisticos"; 
3371;"Basilica Pontificia de San Miguel";"";"";"";"Metro: Sol (lineas 1, 2 y 3), Tirso de Molina (linea 1), La Latina (linea 5)  Renfe: Sol (lineas 3 y 4)  Bus: 3, 17, 18, 23, 31, 35, 50, 65, 148";"";"0";"http://www.madrid.es/sites/v/index.jsp?vgnextchannel=9e4c43db40317010VgnVCM100000dc0ca8c0RCRD&vgnextoid=9c383d232e91f010VgnVCM1000000b205a0aRCRD";"SAN JUSTO";"CALLE";"V";"4";"";"";"";"";"MADRID";"MADRID";"28005";"PALACIO";"CENTRO";"439900";"4474180";"40.414203159177625";"-3.7096715906562716";"915 484 011";"";"";"/contenido/entidadesYorganismos/MonumentosEdificiosArtisticos"; 
1744;"Biblioteca Nacional de Espana";"Fundada por Felipe  V  en 1712 como Biblioteca Publica de Palacio. En 1836 dejo de ser propiedad de la Corona y paso a depender del Ministerio de la Gobernacion y recibio por primera vez el nombre de Biblioteca Nacional y en 1896 se abrio al publico.   Horarios:    Salas de lectura y servicios    De lunes a viernes, de 9 a 21 horas, excepto:  Salas Goya, Cervantes y Barbieri, de 9 a 20 horas.  Oficina de reprografia, de 9 a 19 horas.   Fotocopias al publico, de 9 a 20 horas.  Prestamo interbibliotecario, de 9 a 14:30 horas.      Sabados, de 9 a 14 horas, excepto:  Sala Barbieri, cerrada.  Oficina de reprografia, cerrada.  Fotocopias al publico de 9 a 13 horas.      Exposiciones y Museo    De martes a sabado de 10 a 20 horas.    Domingos y festivos de 10 a 14 horas.      Registro general y carteria    De lunes a jueves de 9 a 14:30 y de 15:30 a 17:30 horas.   Viernes de 9 a 15 horas.    Dias de cierre en 2017 :   1 y 2 de enero.  5 de enero, abierto de 9 a 18 horas.  6 de enero.  7 de enero, abierto de 9 a 14 horas.  20 de marzo.  13, 14 y 15 de abril.  1 y 2 de mayo.  15 de mayo.  15 de agosto.  12 de octubre.  1 y 9 de noviembre.  6, 8, 9, 24, 25 y 31 de diciembre.";"";"";"Metro: Colon (linea 4)  Bus: 1, 5, 9, 14, 19, 21, 27, 37, 45, 51, 53, 74, 150   Cercanias Renfe: Recoletos (lineas C1, C2, C7, C8 y C10)";"";"0";"http://www.madrid.es/sites/v/index.jsp?vgnextchannel=9e4c43db40317010VgnVCM100000dc0ca8c0RCRD&vgnextoid=2b8d995a8bf5d010VgnVCM2000000c205a0aRCRD";"RECOLETOS";"PASEO";"V";"20";"";"";"";"";"MADRID";"MADRID";"28001";"RECOLETOS";"SALAMANCA";"441505";"4475144";"40.423001908945956";"-3.69084423390357";"915 807 823 / 05 (Informacion) 915 807 800 (Centralita) 915 807 894 (Informacion sobre Exposiciones) 915 169 867 (Informacion sobre el Museo y actividades infantiles) 915 807 755 (Registro General y Carteria)                                                                                                
";"";"acceso@bne.es";"/contenido/entidadesYorganismos/MonumentosEdificiosArtisticos"; 
14211;"Bolsa de Madrid";"Es el principal mercado de valores de Espana. Tiene su sede en el Palacio de la Bolsa de Madrid.   Visitas Guiadas al  Palacio de la Bolsa   Todos los dias laborables, en horario de manana, la Bolsa de Madrid abre sus puertas al publico para que puedan recorrer el Palacio de la Bolsa. Todas las visitas son guiadas por personal de la Bolsa de Madrid, con objeto de poder aclarar las preguntas del publico, ofreciendo asi una visita dinamica y participativa.  La visita tiene una duracion aproximada de 60 minutos.   Visitas Individuales    Todos los Jueves a las 12 horas.  Puede realizar su reserva para visitar el Palacio, a traves de la direccion de correo electronico:  visitas@grupobme.es     Visitas de Grupos    Centros de Bachiller (colegios, IES, etc...)  Otros grupos: profesionales, universidades, centros de formacion profesional, asociaciones, etc...  Horario: Desde las 10 horas de lunes a viernes  Grupos de 30 personas como maximo  Edad minima: 16 anos";"";"";"Metro: Banco de Espana (linea 2)  Bus: 1, 2, 5, 9, 10, 15, 20, 34";"Descripcion monumental:  disenado por Enrique Repulles y Vargas en 1884-93. Edificio representativo de estilo neoclasico, en el que, aprovechando un solar irregular, se organiza perfectamente el complejo programa. Interesante sala de operaciones semicircular cubierta por una boveda de hierro y cristal.";"0";"http://www.madrid.es/sites/v/index.jsp?vgnextchannel=9e4c43db40317010VgnVCM100000dc0ca8c0RCRD&vgnextoid=0a9d81eb5f51c010VgnVCM2000000c205a0aRCRD";"LEALTAD";"PLAZA";"V";"1";"";"";"";"";"MADRID";"MADRID";"28014";"LOS JERONIMOS";"RETIRO";"441386";"4474466";"40.41688576337496";"-3.692184322678944";"917 095 000 (Bolsas y mercados espanoles (BME)";"";"infobolsamadrid@grupobme.es";"/contenido/entidadesYorganismos/MonumentosEdificiosArtisticos"; 
1956;"Casa de America";"Antiguo Palacio de Linares, disenado por Carlos Colubi en 1872.  De estilo rococo, destaca la escalera de marmol de Manuel Anibal alvarez y toda la decoracion interior.";"Punto de informacion    Lunes a viernes de 9 a 15 y de 16 a 20:30 horas    Exposiciones (Salas Frida Khalo y Diego Rivera)    Lunes a viernes de 11 a 19:30 horas, sabados de 11 a 15 horas. Domingos cerrado.    Visitas guiadas    Sabados y domingos, a las 11, 12 y 13 horas.    Venta de entradas anticipadas en el Punto de informacion de Casa de America.    Restaurante (Acceso por Paseo Recoletos, 2)    De 13:30 a 16 y de 20:30 a 0 horas. Cerrado domingos todo el dia; lunes y martes noche en otono e invierno.";"Celebracion de actividades culturales: conciertos, conferencias, mesas redondas, actividades infantiles, exposiciones  Sala de exposiciones  Anfiteatro  Centro de informacion y documentacion  Cine  Restaurante, cafeteria. (Acceso por Paseo Recoletos, 2).";"Metro: Banco de Espana (linea 2)  Bus: 1, 2, 3, 5, 9, 10, 14, 15, 20, 27, 34, 37, 45, 51, 52, 53, 74, 146, 150.  Cercanias Renfe: Recoletos (lineas C1, C2, C7, C8 Y C10)";"";"1";"http://www.madrid.es/sites/v/index.jsp?vgnextchannel=9e4c43db40317010VgnVCM100000dc0ca8c0RCRD&vgnextoid=10f979262ef5d010VgnVCM1000000b205a0aRCRD";"CIBELES";"PLAZA";"V";"4";"";"";"";"";"MADRID";"MADRID";"28014";"RECOLETOS";"SALAMANCA";"441379";"4474785";"40.41975904857138";"-3.692284495888486";"915 954 800 (informacion) ";"";"";"/contenido/entidadesYorganismos/Consorcios"; 
20363;"Casa de Cisneros";"Es uno de los pocos palacios renacentistas del siglo XVI conservados en Madrid, aunque con muchas modificaciones.";"";"";"Metro: Sol (lineas 1, 2, 3), opera (lineas R, 2, 5)  Bus: 3, 5, 20, 25, 33, 39, 50, 51, 52, 53, 150";"Descripcion monumental   Casa-palacio mandada construir por Don Benito Jimenez de Cisneros, sobrino del Cardenal Cisneros, en 1537. Posiblemente fue encargada al alarife de la Villa, Miguel de Hita, que utilizo el solar de su antigua casa y el resto de los solares de la manzana que habia adquirido, como consta en un documento de la epoca.   Forma parte del conjunto de la Plaza de la Villa. Despues de la Guerra Civil Felipe Trigo hizo otra reforma interior. Destacan la escalera con azulejos de Talavera y el Salon de los Tapices.   Bibliografia : Arquitectura de Madrid.- Madrid: Fundacion COAM, 2003  Mas informacion en la  pagina web de MonumentaMadrid";"0";"http://www.madrid.es/sites/v/index.jsp?vgnextchannel=9e4c43db40317010VgnVCM100000dc0ca8c0RCRD&vgnextoid=023de35bba51c010VgnVCM2000000c205a0aRCRD";"VILLA";"PLAZA";"V";"4";"";"";"";"C/V CALLE CORDON 1, C/V ROLLO 1, C/V SACRAMENTO 2";"MADRID";"MADRID";"28005";"PALACIO";"CENTRO";"439830";"4474259";"40.41490075227339";"-3.7105039839947347";"";"";"";"/contenido/entidadesYorganismos/MonumentosEdificiosArtisticos"; 
20375;"Casa de La Panaderia";"Iniciada por Diego Sillero en 1590 para el gremio del pan, sera acabada y transformada en 1617 por Gomez de Mora al integrarla en el conjunto de la Plaza Mayor. La planta baja era completamente libre permitiendo el paso entre la calle Mayor y la Plaza. A finales del siglo  XVIII   Juan de Villanueva la restauro tras el incendio de la plaza en 1672. Es de destacar el balcon y Escudo Real de la fachada, asi como sus pinturas.";"";"";"Metro: Sol (lineas 1, 2, 3).  Bus: 3, 50.  Renfe: Sol (lineas C3, C4).";"";"0";"http://www.madrid.es/sites/v/index.jsp?vgnextchannel=9e4c43db40317010VgnVCM100000dc0ca8c0RCRD&vgnextoid=944de35bba51c010VgnVCM2000000c205a0aRCRD";"MAYOR";"PLAZA";"V";"27";"";"";"";"";"MADRID";"MADRID";"28012";"SOL";"CENTRO";"440092";"4474361";"40.41583855082183";"-3.7074257084323636";"";"";"";"/contenido/entidadesYorganismos/MonumentosEdificiosArtisticos"; 
71807;"Casa de La Villa. Ayuntamiento de Madrid";"";"";"";"Metro: Sol (lineas 1, 2, 3), opera (lineas R, 2, 5)  Bus: 3, 5, 20, 25, 33, 39, 50, 51, 52, 53, 150";"Descripcion monumental    El Ayuntamiento madrileno carecio de inmueble propio hasta finalizar el siglo XVI, celebrando sus sesiones en la antigua parroquia de San Salvador, situada en la calle Mayor esquina calle Senores de Luzon.   En 1599 se compraron varias casas en la manzana 182, donde se instalo provisionalmente, y que se derribaron en 1620 para construir el actual edificio. Entonces el Consejo pidio licencia al rey para hacer la Casa del Ayuntamiento. En 1629 se aprobo el proyecto de Juan Gomez de Mora, empezando las obras anos mas tarde.  El edificio estuvo planteado con doble funcion: acoger los servicios municipales y la carcel de la Villa. El resultado fue un edificio exento con planta compuesta en torno a un patio cuadrado, dejando el vestibulo y salones principales en las fachadas principales y el resto de las dependencias en las secundarias.  Las fachadas en ladrillo, granito y pizarra presentan distintos tratamientos por su diferente funcion y situacion urbana, siguiendo la linea de la arquitectura madrilena del siglo XVII impuesta por Gomez de Mora. La fachada a la plaza de la Villa tiene una distribucion simetrica entre torres angulares rematadas con chapitel.  La fachada a la calle Mayor, reformada por Juan de Villanueva siguiendo el diseno de Mateo G&uuml;ill, mantiene las torres angulares y varia el segundo cuerpo, introduciendo en el una  loggia  de orden dorico como gran mirador sobre la calle, que acentua los juegos de luz y sombra.  A lo largo de los siglos XIX y XX se realizaron ampliaciones y reformas interiores para dar cabida a los nuevos servicios del Ayuntamiento.  En la actualidad la sede del Ayuntamiento de Madrid se encuentra en el Palacio de Cibeles.   Autores    Juan Gomez de Mora: 1629 (P)  Juan Gomez de Mora, Jose de Villarreal, Bartolome Hurtado, Jose del Olmo, Manuel del Olmo, Cristobal de Aguilera y Teodoro Ardemans: 1644-1696 (O)  Reforma fachada  c/  Mayor: Mateo G&uuml;ill y Juan de Villanueva: 1785-1789 (O)  Ampliacion: Juan Jose Sanchez Pescador: 1857-1859 (O)  Primera restauracion: Lucio Onoro Dominguez: 1969-1975 (O)  Segunda restauracion: Joaquin Roldan Pascual: patio de cristales: 1984-1985 (O), salon de plenos: 1985 (O), saletas diversas: 1986 (O) y capilla: 1991 (Co)    Mas informacion en  la  pagina de Monumentamadrid";"0";"http://www.madrid.es/sites/v/index.jsp?vgnextchannel=9e4c43db40317010VgnVCM100000dc0ca8c0RCRD&vgnextoid=483f68540e41c010VgnVCM2000000c205a0aRCRD";"VILLA";"PLAZA";"V";"5";"";"";"";"";"MADRID";"MADRID";"28005";"PALACIO";"CENTRO";"439820";"4474291";"40.41518829867041";"-3.7106248754622504";"";"";"";"/contenido/entidadesYorganismos/MonumentosEdificiosArtisticos"; 
20379;"Casa de Las Siete Chimeneas";"Casa palacio construida en 1577 por Antonio Sillero. Ha sufrido numerosas reformas, siendo las mas destacadas las del siglo XIX, a cargo de Agustin Ortiz de Villajos y Antonio Capo. Posteriormente ha sido reformada por Chueca Goitia y Dominguez Salazar. Destaca por las chimeneas que coronan el tejado. Es un ejemplo de la arquitectura domestica del siglo XV.  En la actualidad estan ubicadas dependencias del Ministerio de Cultura.";"";"";"Metro: Banco de Espana (linea 2)  Bus: 1, 2, 5, 9, 15, 20, 46, 51, 52, 53, 74, 146, 150  Renfe: Recoletos";"";"0";"http://www.madrid.es/sites/v/index.jsp?vgnextchannel=9e4c43db40317010VgnVCM100000dc0ca8c0RCRD&vgnextoid=275de35bba51c010VgnVCM2000000c205a0aRCRD";"REY";"PLAZA";"V";"1";"";"";"";"C/V INFANTAS, 31, C/V COLMENARES";"MADRID";"MADRID";"28004";"JUSTICIA";"CENTRO";"441029";"4474838";"40.42020264263883";"-3.6964264776282376";"";"";"";"/contenido/entidadesYorganismos/MonumentosEdificiosArtisticos"; 
20390;"Casa de Velazquez";"Centro de creacion artistica y de investigacion situado en un palacete de estilo neoclasico de 1920.";"";"Desarrollo de actividades creadoras e investigaciones relacionadas con las artes, las lenguas, las literaturas y las sociedades de paises ibericos, iberoamericanos y del Magreb.";"Bus: 83 , 133, 162  Metro: Ciudad Universitaria (linea 6)";"Descripcion monumental:  el edificio es un palacete de estilo neoclasico inaugurado en 1928, por encargo del gobierno frances a los arquitectos Chifflot y Lefevre, en un terreno concedido por el Rey Alfonso XIII. Desde su fundacion la institucion acoge a jovenes investigadores y artistas emergentes.";"0";"http://www.madrid.es/sites/v/index.jsp?vgnextchannel=9e4c43db40317010VgnVCM100000dc0ca8c0RCRD&vgnextoid=a48de35bba51c010VgnVCM2000000c205a0aRCRD";"PAUL GUINARD";"CALLE";"V";"3";"";"";"";"";"MADRID";"MADRID";"28040";"CIUDAD UNIVERSITARIA";"MONCLOA-ARAVACA";"438201";"4477170";"40.441013640676644";"-3.7299866834370903";"914 551 580";"915 497 250";"";"/contenido/entidadesYorganismos/MonumentosEdificiosArtisticos"; 
2064;"Cason del Buen Retiro";"Edificio que forma parte del Museo Nacional del Prado, donde pueden consultarse fondos de la Biblioteca, del Archivo y del Servicio de Documentacion de la coleccion del Museo y de otras fuentes relativas a la historia del arte.";"Mananas     De lunes a jueves, de 9 a 15 h (Servicio de libros y otros materiales hasta las 14:30 horas)    Viernes, de 9 a 14:30 horas (Servicio de libros y otros materiales hasta las 14 h)     Tardes   Lunes y miercoles, de 15 a 18 horas (Servicio de libros y otros materiales hasta las 17:30 horas)   Horario de verano     Desde el 16 de junio al 15 de septiembre, de lunes a viernes, de 9 a 14:30 horas";"";"Metro: Atocha (Linea 1)  Bus: 19, 10, 14, 27, 34, 37, 45  Renfe: Atocha";"Descripcion monumental   El Cason o Salon de Baile es el unico volumen que permanece del antiguo Palacio del buen Retiro, ejecutado en 1637 con un proyecto de Alonso Carbonel. Aun se conserva la boveda de canon con lunetas, pintada al fresco por Lucas Jordan en 1692 con la Alegoria del Toison de Oro. Su fachada principal, a poniente, arrasada la primitiva en 1886 por un ciclon, es de Velazquez Bosco. La ultima rehabilitacion ha sido realizada por Jaime Torruell.";"0";"http://www.madrid.es/sites/v/index.jsp?vgnextchannel=9e4c43db40317010VgnVCM100000dc0ca8c0RCRD&vgnextoid=f0443d0b5e71c010VgnVCM1000000b205a0aRCRD";"ALFONSO XII";"CALLE";"V";"28";"";"";"";"";"MADRID";"MADRID";"28014";"LOS JERONIMOS";"RETIRO";"441635";"4474285";"40.415263749471535";"-3.689232811717636";"913 302 828 / 913 302 009";"";"biblioteca@museodelprado.es";"/contenido/entidadesYorganismos/MonumentosEdificiosArtisticos"; 
5682031;"Castillo de la Alameda";"El Castillo de la Alameda o de Barajas se trata de uno de los escasos vestigios de la arquitectura militar del pasado siglo  XV  y uno de los pocos castillos que ha sobrevivido al paso del tiempo. Bajo el y su entorno, existen restos de asentamientos antiguos desde la Edad del Bronce hasta la epoca Romana. En el edificio se realizan talleres para escolares y actividades en verano.";"Abierto fines de semana y festivos (incluso los lunes festivos)  De 1 de abril a 15 de junio y de 15 de septiembre a 30 de septiembre: sabados, domingos y festivos de 10 a 21 horas.  De 16 de junio a 15 de septiembre: sabados, domingos y festivos de 10 a 20 horas.  De octubre a marzo: sabados, domingos y festivos de 10 a 18 horas.  Cerrado: 24, 25, 31 de diciembre, 1 de enero, 6 de enero, 1 de mayo.";"Accesibilidad    Rampas de acceso  Servicios para minusvalidos  Informacion en Braille para invidentes";"Metro: Alameda de Osuna (linea 5), El Capricho (linea 5)  Autobuses: 101, 105, 112, 114, 115 y 151";"";"1";"http://www.madrid.es/sites/v/index.jsp?vgnextchannel=9e4c43db40317010VgnVCM100000dc0ca8c0RCRD&vgnextoid=fe43c4be8e688210VgnVCM1000000b205a0aRCRD";"ANTONIO SANCHA";"CALLE";"V";"1";"";"";"";"";"MADRID";"MADRID";"28042";"ALAMEDA DE OSUNA";"BARAJAS";"449807";"4479009";"40.45835460563491";"-3.5932903820278788";"913 667 415                                                                         
";"";"castilloalameda@madrid.es";"/contenido/entidadesYorganismos/MonumentosEdificiosArtisticos"; 
3361;"Catedral Santa Maria la Real de la Almudena";"Su construccion comienza a finales del siglo XIX por el Marques de Cubas, sobre el primer recinto amurallado del Madrid musulman, y finaliza en el ano 1993.";"";"";"Metro: opera (lineas 2, 5, Ramal), Sol (Linea 1, 2, 3)  Bus: 3, 31, 41, 50, 62, 65, 148, C1, C2";"";"0";"http://www.madrid.es/sites/v/index.jsp?vgnextchannel=9e4c43db40317010VgnVCM100000dc0ca8c0RCRD&vgnextoid=15647b503a71c010VgnVCM1000000b205a0aRCRD";"MAYOR";"CALLE";"V";"90";"";"";"";"";"MADRID";"MADRID";"28013";"PALACIO";"CENTRO";"439514";"4474295";"40.41521119054696";"-3.7142200549476727";"915 480 930";"";"";"/contenido/entidadesYorganismos/MonumentosEdificiosArtisticos"; 
1916;"Centro Conde Duque";"Centro Conde Duque es un espacio cultural vinculado a la memoria y a la la difusion de Madrid.  Entre sus fines se encuentran: la difusion de la historia de Madrid, el intercambio de conocimientos historicos con la sociedad, la conservacion de  los fondos historicos y artisticos del Ayuntamiento y la produccion y exhibicion de manifestaciones artisticas relacionadas con el mundo de la escena y de la musica.";"Exposiciones (entrada gratuita)    De martes a sabado de 10 a 14 y de 17:30 a 21 horas.  Domingos y festivos de 10:30 a 14 horas.";"Salas de Exposiciones:  espacios expositivos con mas de mil quinientos metros cuadrados, caracterizada por sus muros de ladrillo y por los espacios abovedados.   Auditorio Conde Duque:  1300 metros cuadrados, renovados en el 2011.   Teatro Conde Duque : espacio escenico moderno y versatil, con una escena de 12 por 17 metros de superficie y un peine de 5,99 metros de altura. Cuenta, ademas, con dos grandes salas de ensayo adyacentes.    Salon de Actos: u na gran sala de doble altura, totalmente forrada de madera, que esta preparada para la realizacion de conferencias, presentaciones, congresos y seminarios. Ocupa las plantas primera y segunda de la zona del edificio que se situa encima del vestibulo general desde el que tiene acceso. Dotado de medios de audicion y gran pantalla de proyeccion, dispone de una capacidad de 293 asientos.     Zona wifi .";"Metro: Ventura Rodriguez (linea 3), San Bernardo (linea 2 y 4) y Noviciado (linea 2).  Bus: 1, 2, 44, 74, 133, 202, 749, Minibus M-2";"Teatro, Auditorio     Venta de entradas:   www.entradas.com   y taquilla del recinto  Contacto: 917 220 573 (de lunes a viernes de 10 a 14:30 horas y de 16 a 17 horas)  Correo electronico:  actividades@condeduquemadrid.es     Salon de actos, Salas de ensayo y Eventos    Contacto: 917 220 573 (de lunes a viernes de 10 a 14:30 horas y de 16 a 17 horas)  Correo electronico:  actividades@condeduquemadrid.es     Exposiciones: entrada gratuita    Contacto: 914 800 401  Correo electronico:  cdinfoexposiciones@madrid.es";"1";"http://www.madrid.es/sites/v/index.jsp?vgnextchannel=9e4c43db40317010VgnVCM100000dc0ca8c0RCRD&vgnextoid=64463d0b5e71c010VgnVCM1000000b205a0aRCRD";"CONDE DUQUE";"CALLE";"V";"11";"";"";"";"";"MADRID";"MADRID";"28015";"UNIVERSIDAD";"CENTRO";"439869";"4475716";"40.42802889001877";"-3.710182353581842";"";"";"";"/contenido/entidadesYorganismos/MonumentosEdificiosArtisticos"; 
2000;"Centro de Estudios Politicos y Constitucionales";"Construido por Sabatini en 1776. Tipologia singular sin apartarse de los criterios clasico-barrocos, propios de la epoca de Carlos III. Destaca su escalera barroca. Fue creado para alojamiento y vivienda de Grimaldi. En 1819 se instalo la Biblioteca Real, y posteriormente las Secretarias, llamandose entonces Casa de los Ministerios.";"";"";"Metro: Santo Domingo (linea 2), Plaza de Espana (linea 3), opera (linea R, 2, 5)  Bus: 3,, 25, 39, 46, 75, 138, 148, C1, C2";"";"0";"http://www.madrid.es/sites/v/index.jsp?vgnextchannel=9e4c43db40317010VgnVCM100000dc0ca8c0RCRD&vgnextoid=8c5d1e79ee71c010VgnVCM1000000b205a0aRCRD";"MARINA ESPA&Ntilde;OLA";"PLAZA";"V";"9";"";"";"";"";"MADRID";"MADRID";"28013";"PALACIO";"CENTRO";"439669";"4474896";"40.42063654129458";"-3.7124503472242387";"915 401 950";"914 228 992";"cepc@cepc.es";"/contenido/entidadesYorganismos/MonumentosEdificiosArtisticos"; 
103331;"Centro Social y Cultural La Casa Encendida";"Edificio de caracter monumental. De estilo neomudejar, fue disenado por el arquitecto Fernando Arbos e inaugurado en el ano 1913. Cuenta con mas de 6.000 metros cuadrados de instalaciones divididas en 4 plantas y una azotea.";"De martes a domingo de 10 a 22 horas (todos los dias del ano, excepto festividades nacionales y de la Comunidad de Madrid)  Exposiciones: de 10 a 21:45 horas";"Biblioteca  (Consulta catalogo  http://koha.montemadrid.es/ )   Biblioteca (Hemeroteca, Mediateca y Sala de ofimatica) : de martes a domingos de 10 a 21:15 horas. Del 1 al 15 agosto, mediateca cerrada   Biblioteca joven:  de martes a viernes, de 10 a 20:30 horas, sabados y domingos de 10 a 13:30 horas   Bebeteca:  sabados y domingos de 10 a 13:30 horas     Tienda solidaria:  De martes a viernes de 11 a 21 horas. Sabados y domingos de 11 a 15 y de 16:30 a 21 horas   Cafeteria:  De martes a domingo de 10 a 20:30 horas";"Metro: Embajadores (linea 3), Lavapies (linea 3)  Bus: 27, 34, 36, 41, 119,  C 1,  C 2  Renfe: Embajadores";"Tarifas 2017:    Exposiciones, Encuentros y Salidas: entrada libre  Audiovisuales y En Familia: 3 euros  Conciertos y escenicas: 5 euros  Cursos, talleres y campamentos: consultar cada actividad   Visitas guiadas y atencion en sala: sabados y domingos de 12 a 14 horas y de 17 a 20 horas  Sin inscripcion previa (gratuita)";"1";"http://www.madrid.es/sites/v/index.jsp?vgnextchannel=9e4c43db40317010VgnVCM100000dc0ca8c0RCRD&vgnextoid=c27f8899fc81c010VgnVCM1000000b205a0aRCRD";"VALENCIA";"RONDA";"V";"2";"";"";"";"";"MADRID";"MADRID";"28012";"EMBAJADORES";"CENTRO";"440732";"4473259";"40.40595710517701";"-3.699779793558763";"902 430 322                                                                 
";"";"lacasaencendida@montemadrid.es";"/contenido/entidadesYorganismos/MonumentosEdificiosArtisticos"; 
2045;"Circulo de Bellas Artes";"";"Salas de exposiciones:  de 11 a 14 y de 17 a 21 horas. (martes a domingo). Lunes cerrado.   Azotea:  de lunes a viernes de 9 a 21 horas, sabados, domingos y festivos de 11 a 21 horas (horario sujeto a cambios).   Taquilla (cine y espectaculos):  de 16 a 22 horas (miercoles a domingo). Horario sujeto a cambios   Cafeteria 'La Pecera':  De 8 a 1 horas, viernes, sabado y domingo hasta las 3 horas.";"Acceso para minusvalidos (solo la primera planta).  Terraza - azotea visitable  Cafeteria  Teatro";"Metro: Banco de Espana (linea 2)  Bus: 1, 2, 3, 5, 9, 46, 51, 52, 53, 74, 146, 150, 202";"Descripcion monumental    Arquitecto : Antonio Palacios (1919 - 1926). Este edificio de imagen urbana, monumental y eclectica, gracias a su volumetria y al tratamiento de las fachadas, se remata con una torre a modo de faro cultural y una Minerva en bronce esculpida por Juan Luis Vassallo. Los altorrelieves fueron realizados por Jose Capuz, Juan Adsuara y la colaboracion de angel Garcia Diaz.";"1";"http://www.madrid.es/sites/v/index.jsp?vgnextchannel=9e4c43db40317010VgnVCM100000dc0ca8c0RCRD&vgnextoid=8fdf1e79ee71c010VgnVCM1000000b205a0aRCRD";"ALCALa";"CALLE";"V";"42";"";"";"";"";"MADRID";"MADRID";"28014";"CORTES";"CENTRO";"441012";"4474640";"40.41842683569739";"-3.6965967618484465";"913 605 400 (Informacion general) / 913 892 426 (taquilla)                                                                          
";"";"info@circulobellasartes.com";"/contenido/entidadesYorganismos/Consorcios"; 
