PK;NOMBRE;DESCRIPCION-ENTIDAD;HORARIO;EQUIPAMIENTO;TRANSPORTE;DESCRIPCION;ACCESIBILIDAD;CONTENT-URL;NOMBRE-VIA;CLASE-VIAL;TIPO-NUM;NUM;PLANTA;PUERTA;ESCALERAS;ORIENTACION;LOCALIDAD;PROVINCIA;CODIGO-POSTAL;BARRIO;DISTRITO;COORDENADA-X;COORDENADA-Y;LATITUD;LONGITUD;TELEFONO;FAX;EMAIL;TIPO;
20;"Congreso de los Diputados";"El Congreso de los Diputados esta configurado por un complejo de cinco edificios con una superficie de cerca de setenta mil metros cuadrados.";"";"";"Metro: Sevilla (linea 2), Banco de Espana (linea 2)  Bus: 5, 9, 10, 14, 15, 20, 27, 34, 37, 45, 51, 52, 53,150";"Descripcion monumental   El edificio fue construido por Pascual Colomer entre 1843 y 1850. Destaca su planta adaptada al edificio anterior y la conjugacion de salas de diferente superficie, entre ellas el Salon de Sesiones, que es semicircular, cerrado por la tribuna de la presidencia. La fachada principal esta compuesta por un potente portico clasico de orden corintio con fronton triangular. Los leones de bronce de la entrada y el relieve del fronton fueron realizados por Ponciano Ponzano. Tambien destacan las pinturas interiores de Luis Ribera y Vicente Camaron.";"1";"http://www.madrid.es/sites/v/index.jsp?vgnextchannel=9e4c43db40317010VgnVCM100000dc0ca8c0RCRD&vgnextoid=365f29ea9281c010VgnVCM1000000b205a0aRCRD";"CORTES";"PLAZA";"V";"1";"";"";"";"";"MADRID";"MADRID";"28014";"CORTES";"CENTRO";"440970";"4474401";"40.41626174493484";"-3.697081267552528";"913 906 000";"914 298 707";"informacion@congreso.es";"/contenido/entidadesYorganismos/MonumentosEdificiosArtisticos"; 
14218;"Consejo de Estado";"Es el supremo organo consultivo del Gobierno. Actualmente se rige por la  Ley Organica 3/1980, de 22 de abril, y su Reglamento es de 18 de julio del mismo ano.  (Modificados por Ley Organica 3/2004 de 28 de diciembre) y (Real Decreto 449/2005 de 22 de abril).   No forma parte de la Administracion activa ni esta integrado en ninguno de los Departamentos ministeriales y, aunque la Constitucion de 1978 lo califique literalmente de organo consultivo del Gobierno, tiene en realidad el caracter de organo del Estado (Sentencia del Tribunal Constitucional 56/1990, de 29 de marzo).";"";"Archivo y Biblioteca:    Telefonos: 915 166 356 / 915 166 357  Fax: 915 166 364  Correo electroncio:  archivo.biblioteca@consejo-estado.es     Asuntos en tramitacion:    Telefonos: 915 166 240/ 915 166 241  Fax: 915 166 244  Correo electronico:    tramitaciones@consejo-estado.es     Solicitud de copia de dictamenes:    Por correo electronico:  consultas@consejo-estado.es   Por correo ordinario dirigido a: area de Gestion y Servicios Generales Consejo de Estado  C/ Mayor 79 28013 Madrid";"Metro: opera (lineas 2 y 5)  Bus: 3, 31, 50, 65, 148";"";"0";"http://www.madrid.es/sites/v/index.jsp?vgnextchannel=9e4c43db40317010VgnVCM100000dc0ca8c0RCRD&vgnextoid=ff4ed4985261c010VgnVCM1000000b205a0aRCRD";"MAYOR";"CALLE";"V";"79";"";"";"";"";"MADRID";"MADRID";"28013";"PALACIO";"CENTRO";"439623";"4474268";"40.4149668099875";"-3.7129445136801347";"915 166 262";"915 166 250 (area de Gestion y Servicios Generales)";"consultas@consejo-estado.es";"/contenido/entidadesYorganismos/MonumentosEdificiosArtisticos"; 
3354;"Convento de las Comendadoras de Santiago";"El templo fue construido entre 1667 y 1679 por Manuel del Olmo y Jose del Olmo. El convento data del siglo  XVIII   y es obra de Francisco de Sabatini. Es destacable la iglesia de planta cruciforme con gran cupula central y cuatro exedras semicirculares, asi como la sacristia de planta eliptica construida entre 1745 y 1754 por Francisco Moradillo.";"";"";"Metro: San Bernardo (lineas 2, 4), Ventura Rodriguez (linea 3)  Bus: 1, 2, 21, 44, 74, 133, 147, C";"Mas informacion en la  pagina web de Monumenta Madrid";"0";"http://www.madrid.es/sites/v/index.jsp?vgnextchannel=9e4c43db40317010VgnVCM100000dc0ca8c0RCRD&vgnextoid=ee6b13db5b71c010VgnVCM1000000b205a0aRCRD";"COMENDADORAS";"PLAZA";"V";"10";"";"";"";"";"MADRID";"MADRID";"28015";"UNIVERSIDAD";"CENTRO";"439973";"4475645";"40.4273968151307";"-3.708949668437218";"";"";"";"/contenido/entidadesYorganismos/MonumentosEdificiosArtisticos"; 
20432;"Edificio Metropolis";"Arquitectos : Jules y Reymond Fevrier y Luis Esteve (1906 - 1910)  Edificio de caracter monumental de estilo clasicista - frances de fin de siglo, aporta una buena solucion de esquina para el arranque de la Gran Via en la rotonda de columnas corintias de orden gigante que sostienen un tercer piso profuso en grupos escultoricos de Saint Marceux, Landousky, Lambert y Benlliure.   La Compania Metropolis sustituyo en 1975 el grupo escultorico de la Union y el Fenix que coronaba la cupula por una victoria alada de Federico Coullaut Valera.";"";"";"Metro: Sevilla (linea 2), Banco de Espana (linea 2)  Bus: 1, 2, 5, 9, 15, 20, 51, 52, 53, 74, 146, 150, 202";"";"0";"http://www.madrid.es/sites/v/index.jsp?vgnextchannel=9e4c43db40317010VgnVCM100000dc0ca8c0RCRD&vgnextoid=6c3c7d448b51c010VgnVCM2000000c205a0aRCRD";"ALCALA";"CALLE";"V";"39";"";"";"";"";"MADRID";"MADRID";"28014";"CORTES";"CENTRO";"440930";"4474668";"40.41866416622284";"-3.6975775550486154";"";"";"";"/contenido/entidadesYorganismos/MonumentosEdificiosArtisticos"; 
6469186;"Ermita de San Antonio de la Florida (Museo)";"Ermita dedicada a San Antonio de Padua y pequeno museo. Las pinturas murales que la decoran son de Francisco de Goya. Alberga los restos mortales del artista desde 1919. Para preservar sus pinturas, en 1929 se traslado el culto a una ermita gemela construida a su lado, dejando el edificio original como museo.";"Horario de Verano hasta el 15 de septiembre:  De martes a domingos de 9:30 a 14 horas y de 15 a 19 horas.   Cerrado  los lunes, incluidos festivos, y los dias 1 y 6 de enero, 1 de mayo y 24, 25 y 31 de diciembre.   ultimo pase de visita:  20 minutos antes del cierre (el desalojo de las salas comenzara 10 minutos antes)   Por motivos de conservacion, el aforo maximo es de 25 personas en el interior de la capilla.  Los sabados que se celebren visitas animadas para familias se interrumpira la visita durante el desarrollo de las mismas.  Este horario y la apertura de salas pueden sufrir modificaciones.";"Tienda, en la que se pueden adquirir las guias y publicaciones sobre la ermita editadas por el Museo y otros organismos publicos, asi como catalogos y publicaciones de instituciones culturales del Ayuntamiento de Madrid.";"Metro: Principe Pio (lineas 5, 10 y ramal opera - Principe Pio)  Bus: 41, 46 y 75 (Intercambiador Principe Pio)  Renfe: Principe Pio";"";"0";"http://www.madrid.es/sites/v/index.jsp?vgnextchannel=9e4c43db40317010VgnVCM100000dc0ca8c0RCRD&vgnextoid=75950204770e7310VgnVCM2000000c205a0aRCRD";"SAN ANTONIO DE LA FLORIDA";"GLORIETA";"V";"5";"";"";"";"";"MADRID";"MADRID";"28008";"CASA DE CAMPO";"MONCLOA-ARAVACA";"438548";"4475419";"40.425256682855846";"-3.725725718176111";"915 420 722";"";"sanantonio@madrid.es";"/contenido/entidadesYorganismos/MonumentosEdificiosArtisticos"; 
6079820;"Ermita de San Isidro";"";"Ermita:  sabados de 11 a 13 horas (celebracion de la Eucaristia a las 12 horas).   Fuente del Santo:  solo permanece abierta desde la semana anterior a la fiesta de San Isidro hasta la semana posterior.   Oficio en rito hispano mozarabe:  los dias 2 de enero a las 18 horas (comienzo del ano Caput anni) y 11 de mayo a las 18,30 horas (aniversario de la dedicacion).";"";"Metro: Marques de Vadillo (linea 5)   Bus: 17, 25, 50";"Descripcion monumental:  construida en 1528, sufre una completa transformacion en 1725.";"0";"http://www.madrid.es/sites/v/index.jsp?vgnextchannel=9e4c43db40317010VgnVCM100000dc0ca8c0RCRD&vgnextoid=913cfa8389c10310VgnVCM1000000b205a0aRCRD";"QUINCE DE MAYO";"PASEO";"V";"62";"";"";"";"";"MADRID";"MADRID";"28019";"SAN ISIDRO";"CARABANCHEL";"438018";"4472563";"40.39949832410487";"-3.73168274610084";"913 650 841";"";"";"/contenido/entidadesYorganismos/MonumentosEdificiosArtisticos"; 
35254;"Ermita de Santa Maria la Antigua";"";"";"";"Bus: 34, 108";"";"0";"http://www.madrid.es/sites/v/index.jsp?vgnextchannel=9e4c43db40317010VgnVCM100000dc0ca8c0RCRD&vgnextoid=f19e059cb751c010VgnVCM2000000c205a0aRCRD";"MONSEnOR OSCAR ROMERO";"CALLE";"V";"1";"";"";"";"";"MADRID";"MADRID";"28025";"PUERTA BONITA";"CARABANCHEL";"437153";"4470440";"40.380299379931614";"-3.741676977905724";"914 628 536 (Parroquia de San Sebastian Martir)";"";"";"/contenido/entidadesYorganismos/MonumentosEdificiosArtisticos"; 
3357;"Ermita Virgen del Puerto";"";"";"";"Metro: Puerta del angel (linea 6), Principe Pio (lineas 6 y 10)  Renfe: Principe Pio (lineas 1, 7 y 10)  Bus: 25, 31, 33, 39, 41, 62, 65, 138";"Descripcion monumental:  Construido por Pedro Ribera en 1.718.  Se encuadra en un proyecto urbanistico propuesto por el propio arquitecto para toda la ribera del Manzanares.  De planta octogonal con exedras, lleva cubierta de pizarra.";"0";"http://www.madrid.es/sites/v/index.jsp?vgnextchannel=9e4c43db40317010VgnVCM100000dc0ca8c0RCRD&vgnextoid=fd7755004e91f010VgnVCM2000000c205a0aRCRD";"VIRGEN DEL PUERTO";"PASEO";"V";"4";"";"";"";"";"MADRID";"MADRID";"28005";"PALACIO";"CENTRO";"438928";"4474339";"40.41556461689203";"-3.7211426105677465";"";"";"";"/contenido/entidadesYorganismos/MonumentosEdificiosArtisticos"; 
13151;"Estacion ferroviaria Madrid Puerta de Atocha";"Edificio con caracter monumental construido en 1889 por Alberto del Palacio para la Compania Madrid - Zaragoza - Alicante, en sustitucion de la de los anos 50";"Horario de la estacion: de 05:00 a 01:00 horas  Horario de atencion al cliente: de 6:30 a 22:30 horas  Horario de informacion: de 6:30 a 22:30 horas  Venta inmediata de billetes: de 5:30 a 22:15 horas. Sabados, domingos y festivos: de 06:15 a 22:15 horas.  Venta anticipada de billetes: de 06:30 a 20:00 horas  Maquinas autoventa multiproducto: de 5:30 a 23:50 horas  Horario consignas: de 6:30 a 22:20 horas";"Adaptada a personas sordas y con discapacidad auditiva.   Aseos, cafeteria restaurante, cajeros automaticos, aparcamiento, comisaria de Policia Nacional, consigna, tiendas, servicios de alquiler de coches y de cambio de moneda, informacion turistica, libreria, recogida de billetes de venta telefonica e internet y sala Club   Servicios adaptados : atencion a viajeros con discapacidad - aseos para personas con discapacidad - Vestibulo zona comercial - Sillas de ruedas - Ascensores adaptados  - Andenes adaptados";"Metro: Atocha Renfe (linea 1)  Bus: 10, 19, 24, 47, 55, 57, 85, 102, C1, C2  Renfe: Atocha";"Telefonos de interes:    Informacion, Reserva, Venta Telefonica, Cambios y Anulaciones: 912 320 320.  Informacion Estaciones ADIF: 912 432 343.  Atencion a viajeros con discapacidad: 912 140 505.   La construccion se conforma en base a una gran nave de acero que sirvio de cubierta a vias y andenes en toda su longitud y esta flanqueado por dos edificios de caracter eclectico. Su fachada principal destaca por ser un gran panel de hierro y cristal. La nueva estacion, tal y como la conocemos hoy, es el resultado del proyecto de 1984, ganado por los arquitectos Rafael Moneo y Jose Miguel Leon y el ingeniero Mariano Moneo que comprende la rehabilitacion del edificio historico, nuevas estaciones para cercanias y largo recorrido, conexion con las redes respectivas y con el metro y urbanizacion del entorno, eliminando edificaciones obsoletas y el paso elevado. En la actualidad cuenta con un jardin tropical con 500 especies de plantas.";"1";"http://www.madrid.es/sites/v/index.jsp?vgnextchannel=9e4c43db40317010VgnVCM100000dc0ca8c0RCRD&vgnextoid=28518a856b51c010VgnVCM1000000b205a0aRCRD";"EMPERADOR CARLOS V";"PLAZA";"V";"0";"";"";"";"";"MADRID";"MADRID";"28012";"CORTES";"CENTRO";"441340";"4473655";"40.409567615732286";"-3.692651480759636";"Ver pestana Mas Informacion";"";"";"/contenido/entidadesYorganismos/MonumentosEdificiosArtisticos"; 
162905;"Fundacion BBVA. Palacio del Marques de Salamanca";"";"";"";"";"";"0";"http://www.madrid.es/sites/v/index.jsp?vgnextchannel=9e4c43db40317010VgnVCM100000dc0ca8c0RCRD&vgnextoid=c43a8f90a581c010VgnVCM1000000b205a0aRCRD";"RECOLETOS";"PASEO";"V";"10";"";"";"";"";"MADRID";"MADRID";"28001";"RECOLETOS";"SALAMANCA";"441482";"4474972";"40.42144182034705";"-3.6910993927829567";"91 537 69 64 (Fundacion BBVA)";"";"";"/contenido/entidadesYorganismos/MonumentosEdificiosArtisticos"; 
5703491;"Galeria de Cristal del Palacio de Cibeles";"Una gran boveda acristalada, de geometria irregular y forma organica, cobija  2.800  m&sup2;    de este lugar de representacion, celebracion y encuentro para los ciudadanos y las ciudadanas, bajo el cielo de Madrid. Eleva a 30 metros de altura su transparente levedad (500 toneladas). Esta construida con casi 2.000 cristales triangulares, todos diferentes entre si, formados por 2.966 barras y 1.034 nudos unidos uno a uno.  Tras haber sufrido diversas alteraciones, este espacio, que nace al cubrir el antiguo pasaje Ruiz de Alarcon, antes ocupado por vehiculos de reparto de correo, restaurado y rehabilitado, constituye un elemento esencial de la sede del Ayuntamiento de Madrid.";"De lunes a domingo de 10 a 20 horas, siempre que no haya actividad en el espacio.";"";"Metro: Banco de Espana (linea 2)  Bus: 1, 2, 5, 9, 10, 15, 20, 27, 34, 45, 51, 52, 53, 74, 146, 150  Renfe: Recoletos";"Importe:  entrada gratuita (acceso por portico de la calle Alcala o calle Montalban).     Mas informacion:  este  lugar formo parte del entorno del Palacio Real del Buen Retiro en el siglo  XVII , y en el  XIX  albergo un jardin de recreo. Se incorporo definitivamente como pasaje y patio de descarga del Palacio de Comunicaciones (1904-1919), proyectado por los arquitectos Palacios y Otamendi.";"0";"http://www.madrid.es/sites/v/index.jsp?vgnextchannel=9e4c43db40317010VgnVCM100000dc0ca8c0RCRD&vgnextoid=1f65ef881edd8210VgnVCM2000000c205a0aRCRD";"MONTALBAN";"CALLE";"V";"1";"";"";"";"";"MADRID";"MADRID";"28014";"LOS JERONIMOS";"RETIRO";"441391";"4474623";"40.418291440980205";"-3.69213979278398";"915 217 170 (oficinas)      
";"";"eventos@madrid-destino.com";"/contenido/entidadesYorganismos/MonumentosEdificiosArtisticos"; 
3356;"Iglesia Catedral de las Fuerzas Armadas";"";"";"";"Metro: opera (Lineas , Ramal , 2 , 5), Tirso de Molina (linea 1), La Latina (linea 5)  Bus: 3 , 17 , 31, 41 , 50 , 62, 65, 148";"";"0";"http://www.madrid.es/sites/v/index.jsp?vgnextchannel=9e4c43db40317010VgnVCM100000dc0ca8c0RCRD&vgnextoid=23e03d232e91f010VgnVCM1000000b205a0aRCRD";"SACRAMENTO";"CALLE";"V";"11";"";"";"";"";"MADRID";"MADRID";"28005";"PALACIO";"CENTRO";"439681";"4474259";"40.414889947123754";"-3.7122600779776733";"915 473 624";"";"";"/contenido/entidadesYorganismos/MonumentosEdificiosArtisticos"; 
3363;"Iglesia Corpus Christi (Jeronimas Recoletas)";"";"";"";"Metro: opera (Lineas Ramal , 2 , 5), La Latina (Linea, 5), Tirso de Molina (linea 1)  Bus: 3, 17, 18, 23, 31, 35, 50, 65";"";"0";"http://www.madrid.es/sites/v/index.jsp?vgnextchannel=9e4c43db40317010VgnVCM100000dc0ca8c0RCRD&vgnextoid=e5f03d232e91f010VgnVCM1000000b205a0aRCRD";"CONDE DE MIRANDA";"PLAZA";"V";"3";"";"";"";"";"MADRID";"MADRID";"28005";"PALACIO";"CENTRO";"439888";"4474249";"40.41481486646874";"-3.7098194568632374";"915 480 319";"";"iglesiadelcorpuschristi@archimadrid.es";"/contenido/entidadesYorganismos/MonumentosEdificiosArtisticos"; 
3355;"Iglesia de las Calatravas (Concepcion Real de Calatrava)";"";"";"";"Metro: Sevilla (linea 2)  Bus: 1, 2, 3, 5, 9, 14, 15, 20, 27, 37, 40, 45, 46, 50, 51, 52, 53, 74, 146, 150, 202";"";"0";"http://www.madrid.es/sites/v/index.jsp?vgnextchannel=9e4c43db40317010VgnVCM100000dc0ca8c0RCRD&vgnextoid=e8013d232e91f010VgnVCM1000000b205a0aRCRD";"ALCALA";"CALLE";"V";"25";"";"";"";"";"MADRID";"MADRID";"28014";"CORTES";"CENTRO";"440811";"4474618";"40.418196333786035";"-3.698963613858259";"915 218 035";"";"";"/contenido/entidadesYorganismos/MonumentosEdificiosArtisticos"; 
60150;"Iglesia Madres Redentoristas";"";"";"";"Metro: Carabanchel Alto ( Linea, 11)  Bus: 34 , 35 , 47 , 121 , 131 , 139";"";"0";"http://www.madrid.es/sites/v/index.jsp?vgnextchannel=9e4c43db40317010VgnVCM100000dc0ca8c0RCRD&vgnextoid=28613d232e91f010VgnVCM1000000b205a0aRCRD";"MADRE CELESTE";"CALLE";"V";"1";"";"";"";"";"MADRID";"MADRID";"28044";"BUENAVISTA";"CARABANCHEL";"435956";"4469662";"40.37319952563821";"-3.755699003858804";"915 086 800";"";"";"/contenido/entidadesYorganismos/MonumentosEdificiosArtisticos"; 
3365;"Iglesia San Antonio de los Alemanes";"";"";"";"Metro: Callao (lineas 3 y 5), Gran Via (lineas 1 y 5)  Bus: 1, 2, 46, 74, 146, 202";"Descripcion monumental:   Proyectada por Pedro Sanchez, ano 1624  y Francisco Sesena, ano 1624 - 1633.  Fachada, por Juan Gomez de Mora, ano 1624 - 1630.  Fundacion de Felipe III, 1606.  Magnifico ejemplo del Barroco madrileno con interesantes elementos arquitectonicos y frescos en paredes y cupula que forman una unidad de espacio irreal.  La gran cupula oval, decorada con arquitecturas fingidas y escenas de la Apoteosis de San Francisco de Paula, de Francisco Ricci y Carreno de Miranda,refuerza esta impresion.  Lucas Jordan, sin pauta de continuidad, decora los muros curvos con escenas de la vida del San Antonio.  El retablo mayor, de mediados del siglo XVIII, es obra del arquitecto Miguel Fernandez con el escultor Francisco Gutierrez. Obra compleja, fue replanteada por Juan Gomez de Mora quien redibujo la fachada. Muestra un edificio anexo en ladrillo y planta triangular para la Hermandad del Refugio y Piedad de Madrid, fundada en 1615 con su tradicional &quot;ronda del pan y huevo&quot;.  Dicho edificio data de la decada de 1880, quiza por Ruiz de Salces quien proyecto la reforma de la fachada buscando la armonia total.";"0";"http://www.madrid.es/sites/v/index.jsp?vgnextchannel=9e4c43db40317010VgnVCM100000dc0ca8c0RCRD&vgnextoid=614013db5b71c010VgnVCM1000000b205a0aRCRD";"PUEBLA";"CALLE";"V";"22";"";"";"";"";"MADRID";"MADRID";"28004";"UNIVERSIDAD";"CENTRO";"440533";"4475037";"40.42195996338601";"-3.7022913826706088";"915 223 774";"";"";"/contenido/entidadesYorganismos/MonumentosEdificiosArtisticos"; 
3368;"Iglesia San Ildefonso (Monasterio de las Trinitarias Descalzas)";"";"";"El monumento conmemorativo alberga los restos hallados en la cripta del convento. Con la colocacion de los restos de Miguel de Cervantes en la nave de la actual iglesia del siglo  XVIII   se cumple la voluntad testamentaria del autor de 'El Quijote'. Miguel de Cervantes, que fue enterrado en la primitiva iglesia el 23 de abril de 1616, expreso en su ultima voluntad descansar alli en agradecimiento a los Trinitarios que le liberaron de los cinco anos y medio de cautiverio en Argel, en manos de los piratas berberiscos.";"Metro: Anton Martin (Linea 1)  Bus: 10, 14, 27, 34, 37, 45";"";"0";"http://www.madrid.es/sites/v/index.jsp?vgnextchannel=9e4c43db40317010VgnVCM100000dc0ca8c0RCRD&vgnextoid=4c1013db5b71c010VgnVCM1000000b205a0aRCRD";"LOPE DE VEGA";"CALLE";"V";"18";"";"";"";"";"MADRID";"MADRID";"28014";"CORTES";"CENTRO";"440917";"4474115";"40.41367254153843";"-3.6976792276700987";"914 295 671";"";"";"/contenido/entidadesYorganismos/MonumentosEdificiosArtisticos"; 
3346;"Iglesia San Pedro el Viejo";"";"";"";"Metro: La Latina (Linea 5) Tirso de Molina (Linea 1)  Bus: 3 , 6 , 17 , 18 , 23 , 26 , 31 , 32 , 35 , 41 , 50 , 60 , 65 , 148 , 749";"";"0";"http://www.madrid.es/sites/v/index.jsp?vgnextchannel=9e4c43db40317010VgnVCM100000dc0ca8c0RCRD&vgnextoid=f35013db5b71c010VgnVCM1000000b205a0aRCRD";"NUNCIO";"CALLE";"V";"14";"";"";"";"";"MADRID";"MADRID";"28005";"PALACIO";"CENTRO";"439871";"4474070";"40.41320112124687";"-3.71000286701288";"913 651 284";"";"";"/contenido/entidadesYorganismos/MonumentosEdificiosArtisticos"; 
4280;"Instituto Cervantes";"El antiguo Banco Espanol del Rio de la Plata eligio para su construccion el solar en el que estuvo situado el palacio de Casa Irujo y selecciono a dos arquitectos de la epoca, Palacios y Otamendi. Para algunos autores es su mejor edificio, dentro de ese caracteristico estilo grandioso y monumental que incorpora los ordenes clasicos con vigor, rotundidad y correcta modulacion y los conjuga con la innovacion de las superficies lisas de grandes vanos acristalados. En el chaflan, un grupo de cariatides preside la entrada. Ese mismo argumento de monumentalidad fue el que se utilizo para conceder la licencia constructiva, pues el exceso de altura (25 metros en vez de los 18 permitidos) retraso el permiso para iniciar las obras. La gran carga simbolica del edificio se subrayaba en el patio central de operaciones, que abarcaba la altura de todas las plantas y se remataba con una magnifica cupula vidriera. En torno a el se abrian perimetralmente las distintas dependencias bancarias, conjugando asimismo modernidad y monumentalidad en los elementos constructivos. Ese grandioso espacio central se perdio con la reforma y ampliacion de la decada de 1940, en la que se anadio un nuevo edificio por la calle del Barquillo y se cambio por completo el interior. La fachada de esta ampliacion aspira a repetir el esquema de Palacios y Otamendi sin mimetizarlo.";"Recepcion: 8 a 19 horas  Registro:  lunes a jueves: de 8 a 15 horas  Viernes: de 8 a 14 horas    Exposiciones: consultar programa";"Biblioteca  Canal de television a traves de internet (24 horas de emision)  cervantestv.es";"Metro: Banco de Espana (linea 2)  Bus: 1, 2, 5, 9, 10, 14, 15, 20, 27, 34, 37, 45, 46, 51, 52, 53, 74, 146,150  Renfe: Recoletos";"El Instituto Cervantes es la institucion publica creada por Espana en 1991 para la promocion y la ensenanza de la lengua espanola y de las lenguas cooficiales y para la difusion de la cultura espanola e hispanoamericana. Esta presente en 87 centros distribuidos en 44 paises por los cinco continentes.";"0";"http://www.madrid.es/sites/v/index.jsp?vgnextchannel=9e4c43db40317010VgnVCM100000dc0ca8c0RCRD&vgnextoid=e6c50a47f441f010VgnVCM2000000c205a0aRCRD";"ALCALA";"CALLE";"V";"49";"";"";"";"";"MADRID";"MADRID";"28014";"JUSTICIA";"CENTRO";"441121";"4474731";"40.419245261976";"-3.6953321647484363";"914 367 600";"914 367 691";"informa@cervantes.es";"/contenido/entidadesYorganismos/MonumentosEdificiosArtisticos"; 
6619;"Instituto Italiano de Cultura de Madrid";"Descripcion monumental:  el Palacio de Abrantes inicia su construccion en 1652, aunque las reformas mas importantes se acometen en el siglo  XIX  por Anibal Alvarez Bouquel. Su estilo sigue criterios italianizantes, reflejados en los detalles neorrenacentistas del exterior, semejando los palacios italianos del siglo  XVI.";"Invierno: de lunes a viernes de 9 a 18 horas  Verano: de 9 a 14 horas";"Biblioteca  Cafeteria  Exposiciones  Ciclos de cine  Ensenanza del italiano  Salon de actos";"Metro: Opera (lineas 2 y 5)  Bus: 3, 31, 50, 65, 148";"Objetivo : promover y difundir la lengua y la cultura italianas en Espana a traves de la organizacion de actividades culturales para favorecer la circulacion de las ideas, de las artes y de las ciencias.";"0";"http://www.madrid.es/sites/v/index.jsp?vgnextchannel=9e4c43db40317010VgnVCM100000dc0ca8c0RCRD&vgnextoid=6c4e42be9971c010VgnVCM1000000b205a0aRCRD";"MAYOR";"CALLE";"V";"86";"";"";"";"";"MADRID";"MADRID";"28013";"PALACIO";"CENTRO";"439636";"4474297";"40.41523808103924";"-3.7127823633086336";"915 475 205  / 915 478 603 (Centralita)                 
";"915 422 213";"iicmadrid@esteri.it";"/contenido/entidadesYorganismos/MonumentosEdificiosArtisticos"; 
6374831;"Ministerio de Hacienda y Funcion Publica. Direccion General de Patrimonio del Estado";"";"";"";"Metro: Sol (lineas 1, 2, 3)  Bus: 3, 5, 9, 15, 20, 46, 50, 51, 52, 53, 150, M1, M2  Renfe: Sol";"";"0";"http://www.madrid.es/sites/v/index.jsp?vgnextchannel=9e4c43db40317010VgnVCM100000dc0ca8c0RCRD&vgnextoid=c3ba960e77956310VgnVCM1000000b205a0aRCRD";"ALCALA";"CALLE";"V";"9";"";"";"";"";"MADRID";"MADRID";"28014";"SOL";"CENTRO";"440625";"4474540";"40.417489335230385";"-3.7011604823997892";"915 958 000";"";"";"/contenido/entidadesYorganismos/MonumentosEdificiosArtisticos"; 
5853414;"Ministerio de Hacienda y Funcion Publica. Sede calle Alcala";"Edificio declarado bien de interes cultural, con categoria de monumento.  Construido por Francisco Sabatini en 1769 para Real Casa de Aduanas. Es uno de los primeros edificios neoclasicos de Madrid. Destaca su fachada romana y escalera que forma el nucleo del edificio, lugar de interseccion de toda la circulacion dentro de la organizacion de los tres patios.";"";"Biblioteca.  Real Decreto 415/2016, de 3 de noviembre, por el que se reestructuran los departamentos ministeriales. BOE Num. 267 de 4 de noviembre de 2016:   1. Corresponde al Ministerio de Hacienda y Funcion Publica la propuesta y ejecucion de la politica del Gobierno en materia de hacienda publica, de presupuestos y de gastos, ademas del resto de competencias y atribuciones que le confiere el ordenamiento juridico.  2. Igualmente corresponde a este Ministerio la propuesta y ejecucion de la politica del Gobierno en materia de funcion y gobernanza publicas.  3. Este Ministerio se estructura en los siguientes organos superiores:   a) La Secretaria de Estado de Hacienda.    b) La Secretaria de Estado de Presupuestos y Gastos.    c) La Secretaria de Estado de Funcion Publica";"Metro: Sol (lineas 1, 2, 3), Sevilla (linea 5)  Bus: 3, 5, 9, 15, 20, 46. 50, 51, 52, 53, 150, M1, M2  Renfe: Sol";"";"0";"http://www.madrid.es/sites/v/index.jsp?vgnextchannel=9e4c43db40317010VgnVCM100000dc0ca8c0RCRD&vgnextoid=2828cbfc0ab0c210VgnVCM1000000b205a0aRCRD";"ALCALA";"CALLE";"V";"9";"";"";"";"";"MADRID";"MADRID";"28014";"SOL";"CENTRO";"440625";"4474540";"40.417489335230385";"-3.7011604823997892";"915 958 000 / Servicio de informacion: 900 567 765";"";"";"/contenido/entidadesYorganismos/MonumentosEdificiosArtisticos"; 
