PK;NOMBRE;DESCRIPCION-ENTIDAD;HORARIO;EQUIPAMIENTO;TRANSPORTE;DESCRIPCION;ACCESIBILIDAD;CONTENT-URL;NOMBRE-VIA;CLASE-VIAL;TIPO-NUM;NUM;PLANTA;PUERTA;ESCALERAS;ORIENTACION;LOCALIDAD;PROVINCIA;CODIGO-POSTAL;BARRIO;DISTRITO;COORDENADA-X;COORDENADA-Y;LATITUD;LONGITUD;TELEFONO;FAX;EMAIL;TIPO;
2079;"Panteon de Hombres Ilustres";"La construccion de este edificio responde a dos de las constantes de fines de siglo: la arquitectura historicista y la escultura funeraria. En el reposan trece personajes ilustres de la historia politica y militar espanola.";"De martes a sabado de 10 a 14 y de 16 a 18:30 horas  Domingos y festivos de 10 a 15 horas. Lunes cerrado  Cerrado todos los lunes del ano";"";"Metro: Atocha (linea 1)  Bus: 10, 14, 24, 32, 37, 54, 57, 141  Renfe: Atocha";"Dias de apertura especial para 2017 (abierno horario domingo)    20 de marzo, lunes siguiente a San Jose  13 y 14 de abril, Jueves y Viernes Santo  2 de mayo, Fiesta de la Comunidad de Madrid  15 de mayo, San Isidro, fiesta local   15 de agosto, Asuncion de la Virgen   12 de octubre, Fiesta Nacional de Espana   1 de noviembre, Dia de Todos los Santos   9 de noviembre, Nuestra Senora de la Almudena, fiesta local   6 de diciembre, Constitucion Espanola   8 de diciembre, Inmaculada Concepcion  24 y 31 de diciembre y 1 de enero, ultimo acceso a las 14:30 horas y monumento cerrado a las 15 horas    Dias de cierre para 2017     6 de enero, Epifania del Senor (Reyes Magos)    1 de mayo, Fiesta del Trabajo   25 de diciembre, Natividad del Senor";"0";"http://www.madrid.es/sites/v/index.jsp?vgnextchannel=9e4c43db40317010VgnVCM100000dc0ca8c0RCRD&vgnextoid=361cef4d7f71c010VgnVCM1000000b205a0aRCRD";"JULIAN GAYARRE";"CALLE";"V";"3";"";"";"";"";"MADRID";"MADRID";"28014";"PACIFICO";"RETIRO";"442121";"4473278";"40.40622617519116";"-3.683413041846525";"914 548 700 (Informacion general)";"";"info@patrimonionacional.es";"/contenido/entidadesYorganismos/MonumentosEdificiosArtisticos"; 
3351;"Parroquia Nuestra Senora del Buen Consejo y San Isidro";"";"";"";"Metro: La Latina (linea 5), Tirso de Molina (linea 1)  Bus: 17, 18, 23, 31, 35, 50, 65";"";"0";"http://www.madrid.es/sites/v/index.jsp?vgnextchannel=9e4c43db40317010VgnVCM100000dc0ca8c0RCRD&vgnextoid=88a513db5b71c010VgnVCM1000000b205a0aRCRD";"TOLEDO";"CALLE";"V";"37";"";"";"";"";"MADRID";"MADRID";"28005";"EMBAJADORES";"CENTRO";"440093";"4474042";"40.412964921671964";"-3.707383827213788";"913 692 037";"";"";"/contenido/entidadesYorganismos/MonumentosEdificiosArtisticos"; 
3374;"Parroquia San Fermin de los Navarros";"";"";"";"Metro:  Ruben Dario (Linea 5)  Bus: 5, 7, 14, 16, 27, 40, 45, 147, 150";"";"0";"http://www.madrid.es/sites/v/index.jsp?vgnextchannel=9e4c43db40317010VgnVCM100000dc0ca8c0RCRD&vgnextoid=26390713fb71c010VgnVCM1000000b205a0aRCRD";"EDUARDO DATO";"PASEO";"V";"10";"";"";"";"";"MADRID";"MADRID";"28010";"ALMAGRO";"CHAMBERI";"441366";"4476229";"40.432757364795805";"-3.692571049214642";"913 197 148";"";"";"/contenido/entidadesYorganismos/MonumentosEdificiosArtisticos"; 
3352;"Parroquia San Gines";"";"";"";"Metro: Opera (lineas 2, 5, Ramal)  Bus:  3, 39  Renfe: Sol";"";"0";"http://www.madrid.es/sites/v/index.jsp?vgnextchannel=9e4c43db40317010VgnVCM100000dc0ca8c0RCRD&vgnextoid=520a0713fb71c010VgnVCM1000000b205a0aRCRD";"ARENAL";"CALLE";"V";"13";"";"";"";"";"MADRID";"MADRID";"28013";"SOL";"CENTRO";"440126";"4474520";"40.41728242858594";"-3.707028284837054";"913 664 875";"";"";"/contenido/entidadesYorganismos/MonumentosEdificiosArtisticos"; 
3370;"Parroquia San Jose";"";"";"";"Metro: Banco de Espana (linea 2) , Sevilla (linea 2), Gran Via (Iineas 1, 5)  Bus: 3, 5, 9, 46, 51, 52, 53, 146, 150";"Descripcion monumental.  Convento de Carmelitas Descalzas trazado por Pedro de Ribera entre los anos 1730 y 1742.";"0";"http://www.madrid.es/sites/v/index.jsp?vgnextchannel=9e4c43db40317010VgnVCM100000dc0ca8c0RCRD&vgnextoid=e41a0713fb71c010VgnVCM1000000b205a0aRCRD";"ALCALA";"CALLE";"V";"43";"";"";"";"";"MADRID";"MADRID";"28014";"JUSTICIA";"CENTRO";"441006";"4474710";"40.41904792380414";"-3.6966856794698795";"915 226 784";"";"";"/contenido/entidadesYorganismos/MonumentosEdificiosArtisticos"; 
3375;"Parroquia San Manuel y San Benito";"";"";"";"Metro: Retiro (linea 2), Principe de Vergara (lineas 2, 9)  Bus: 2, 20, 28";"";"0";"http://www.madrid.es/sites/v/index.jsp?vgnextchannel=9e4c43db40317010VgnVCM100000dc0ca8c0RCRD&vgnextoid=b17a0713fb71c010VgnVCM1000000b205a0aRCRD";"ALCALA";"CALLE";"V";"83";"";"";"";"";"MADRID";"MADRID";"28009";"RECOLETOS";"SALAMANCA";"441910";"4474891";"40.42074217866137";"-3.6860471147515685";"914 357 682";"";"";"/contenido/entidadesYorganismos/MonumentosEdificiosArtisticos"; 
3372;"Parroquia San Marcos";"";"";"";"Metro: Plaza de Espana (lineas 3, 10), Noviciado (linea 2)  Bus: 1, 2, 3, 44, 46, 74, 75, 133, 138, 148, C1, C2, M2";"";"0";"http://www.madrid.es/sites/v/index.jsp?vgnextchannel=9e4c43db40317010VgnVCM100000dc0ca8c0RCRD&vgnextoid=448a0713fb71c010VgnVCM1000000b205a0aRCRD";"SAN LEONARDO";"CALLE";"V";"10";"";"";"";"";"MADRID";"MADRID";"28015";"UNIVERSIDAD";"CENTRO";"439783";"4475354";"40.42476160196848";"-3.7111617863516715";"915 471 079 ";"";"";"/contenido/entidadesYorganismos/MonumentosEdificiosArtisticos"; 
3369;"Parroquia San Millan y San Cayetano";"";"";"";"Metro: Latina (linea 5), Lavapies (linea 3)  Bus: M1  Renfe: Embajadores";"";"0";"http://www.madrid.es/sites/v/index.jsp?vgnextchannel=9e4c43db40317010VgnVCM100000dc0ca8c0RCRD&vgnextoid=d69a0713fb71c010VgnVCM1000000b205a0aRCRD";"EMBAJADORES";"CALLE";"NUM";"15";"";"";"";"";"MADRID";"MADRID";"28012";"EMBAJADORES";"CENTRO";"440225";"4473652";"40.409461123751505";"-3.705791428982776";"915 270 790";"";"";"/contenido/entidadesYorganismos/MonumentosEdificiosArtisticos"; 
63393;"Parroquia San Nicolas de Bari de los Servitas";"";"";"Parroquia personal de habla italiana";"Metro: Opera (lineas 2, 5, ramal)  Bus: 3, 148";"";"0";"http://www.madrid.es/sites/v/index.jsp?vgnextchannel=9e4c43db40317010VgnVCM100000dc0ca8c0RCRD&vgnextoid=7838f0bde551c010VgnVCM2000000c205a0aRCRD";"SAN NICOLAS";"PLAZA";"V";"6";"";"";"";"";"MADRID";"MADRID";"28013";"PALACIO";"CENTRO";"439715";"4474359";"40.415793260849824";"-3.7118688527171226";"915 594 064";"";"";"/contenido/entidadesYorganismos/MonumentosEdificiosArtisticos"; 
3358;"Parroquia Santa Barbara";"";"";"";"Metro: Alonso Martinez (lineas 4, 5, 10)  Bus: 3, 5, 14, 21, 27, 37, 45, 53, 150  Renfe: Recoletos";"";"0";"http://www.madrid.es/sites/v/index.jsp?vgnextchannel=9e4c43db40317010VgnVCM100000dc0ca8c0RCRD&vgnextoid=6effb069a541f010VgnVCM1000000b205a0aRCRD";"GENERAL CASTA&Ntilde;OS";"CALLE";"V";"2";"";"";"";"";"MADRID";"MADRID";"28004";"JUSTICIA";"CENTRO";"441231";"4475290";"40.42428879388528";"-3.6940873878242177";"913 194 811";"";"";"/contenido/entidadesYorganismos/MonumentosEdificiosArtisticos"; 
3362;"Parroquia Santa Cruz";"";"";"";"Metro: Sol (lineas 1, 2, 3), Tirso de Molina (linea 1)  Bus: 3, 6, 17, 18, 23, 26, 31, 32, 35, 50, 65, M1  Renfe: Sol";"";"0";"http://www.madrid.es/sites/v/index.jsp?vgnextchannel=9e4c43db40317010VgnVCM100000dc0ca8c0RCRD&vgnextoid=40e0b069a541f010VgnVCM1000000b205a0aRCRD";"ATOCHA";"CALLE";"V";"6";"";"";"";"";"MADRID";"MADRID";"28012";"SOL";"CENTRO";"440274";"4474223";"40.414608558946085";"-3.705255882048698";"913 691 239";"";"";"/contenido/entidadesYorganismos/MonumentosEdificiosArtisticos"; 
3373;"Parroquia Santiago y San Juan Bautista";"";"";"";"Metro: opera (linea 2, 5, Ramal)  Bus: 3, 25, 39, 148";"";"0";"http://www.madrid.es/sites/v/index.jsp?vgnextchannel=9e4c43db40317010VgnVCM100000dc0ca8c0RCRD&vgnextoid=e235b069a541f010VgnVCM1000000b205a0aRCRD";"SANTIAGO";"PLAZA";"V";"24";"";"";"";"";"MADRID";"MADRID";"28013";"PALACIO";"CENTRO";"439803";"4474438";"40.41652031892383";"-3.7108392672110684";"915 480 824";"";"";"/contenido/entidadesYorganismos/MonumentosEdificiosArtisticos"; 
20557;"Plaza de Oriente";"Disenada por Gonzalez Velazquez. Se empieza a construir en 1816, tomandose como eje el Teatro Real enfrentado al Palacio Real. Su trazado definitivo se realiza en 1850 por Narciso Pascual Colomer. Entre 1994 y 1997 se llevo a cabo la remodelacion que integra en un conjunto peatonal el Palacio Real y el Teatro de la Opera, siguiendo el proyecto de los arquitectos Miguel Oriol e Ibarra y Miguel Botella Ruiz-Castillo. Los jardines situados frente al Palacio Real. En el centro de la plaza se encuentra la estatua ecuestre de Felipe IV, obra fundida por Pietro Tacca segun calculos de Galileo Galilei.";"";"";"Metro: opera (lineas 2, 5, R)  Bus: 3, 25, 33, 39, 148";"";"0";"http://www.madrid.es/sites/v/index.jsp?vgnextchannel=9e4c43db40317010VgnVCM100000dc0ca8c0RCRD&vgnextoid=773492355c51c010VgnVCM2000000c205a0aRCRD";"ORIENTE";"PLAZA";"S/N";"0";"";"";"";"";"MADRID";"MADRID";"28013";"PALACIO";"CENTRO";"0";"0";"";"";"";"";"";"/contenido/entidadesYorganismos/MonumentosEdificiosArtisticos"; 
20563;"Plaza Mayor";"Lugar emblematico de Madrid con origen en la antigua Plaza del Arrabal, extramuros del recinto medieval y foco comercial del primitivo Madrid. Tuvo forma irregular debido a su crecimiento espontaneo,  y fue objeto de varios proyectos de regularizacion. Al ser elegida Madrid como capital, se vio la necesidad de crear una autentica Plaza Mayor y Felipe  II   se lo encargo a Juan de Herrera. En el siglo  XIX   se coloco la estatua de Felipe  III  a cuyo reinado pertenece la construccion de la plaza.  Este ano se celebra el  IV Centenario de su construccion.";"";"Todos los domingos de 9 a 14 horas se celebra un mercadillo filatelico (sellos)";"Metro: Sol (lineas 1, 2, 3), Tirso de Molina (linea 1)  Bus: 3, 17, 18, 23, 31";"Mas informacion en la  pagina web de Monumenta Madrid  y  https://plazamayormadrid4c.es";"0";"http://www.madrid.es/sites/v/index.jsp?vgnextchannel=9e4c43db40317010VgnVCM100000dc0ca8c0RCRD&vgnextoid=0a4492355c51c010VgnVCM2000000c205a0aRCRD";"MAYOR";"PLAZA";"V";"0";"";"";"";"";"MADRID";"MADRID";"28012";"SOL";"CENTRO";"440156";"4474266";"40.41498735934118";"-3.706662448203068";"";"";"";"/contenido/entidadesYorganismos/MonumentosEdificiosArtisticos"; 
2430;"Plaza Monumental de Toros de las Ventas";"De estilo neomudejar se termino de construir en el ano 1931. Basada en un proyecto de Jose Espelius, quien murio antes de la conclusion de las obras, fue terminada por Manuel Munoz Monasterio. El terreno se presenta en talud, salvado desde la Avenida de los Toreros mediante escalinatas que interrumpen el trazado ajardinado.";"La plaza de toros de Las Ventas esta abierta  todos los dias de 10 a 17:30 horas, para realizacion de visitas guiadas , excepto dias de cierre excepcional.   Los dias de corrida se cierra 4 horas antes del inicio del espectaculo, que se celebran:   Todos los domingos desde finales de marzo hasta principios de octubre  Durante la Feria de San Isidro  Durante la Feria de Otono en octubre  Dias de cierre: 25 de diciembre, 1 y 6 de enero y 2 de mayo.      Por motivos de organizacion, el Tour podra variar su recorrido y horario informando al visitante antes del acceso.";"";"Metro: Ventas (lineas 2, 5)  Bus: 12, 21, 38, 53, 74, 106, 110, 146, 210";"";"1";"http://www.madrid.es/sites/v/index.jsp?vgnextchannel=9e4c43db40317010VgnVCM100000dc0ca8c0RCRD&vgnextoid=5d7d0713fb71c010VgnVCM1000000b205a0aRCRD";"ALCALA";"CALLE";"V";"237";"";"";"";"";"MADRID";"MADRID";"28028";"GUINDALERA";"SALAMANCA";"443885";"4476078";"40.431580111585106";"-3.6628728693917627";"913 562 200 ";"";"comunicacion@plazauno.es";"/contenido/entidadesYorganismos/MonumentosEdificiosArtisticos"; 
7714918;"Puerta del Sol";"Toma su nombre de un postigo de la antigua muralla medieval que estaba decorado con un Sol y que se derribo en el siglo XVII, el lugar conservo el nombre. En origen fue un punto exterior de la ciudad, aunque debido al crecimiento de Madrid y a su  situacion fue convirtiendose poco a poco en el centro de la capital. En 1857 ,el Ministerio de Fomento  convoca un concurso quedando aprobada la reforma de Lucio del Valle, Juan Rivera y Jose Morer, que conservaba la alineacion de la antigua Casa de Correos en uno de los lados, mientras que el otro adoptaba una forma semicircular.";"";"";"Metro: Sol (lineas 1, 2, 3)  Bus: 15, 20, 51, 52, 53";"";"0";"http://www.madrid.es/sites/v/index.jsp?vgnextchannel=9e4c43db40317010VgnVCM100000dc0ca8c0RCRD&vgnextoid=af0ae1abeee79410VgnVCM2000000c205a0aRCRD";"PUERTA DEL SOL";"PLAZA";"V";"1";"";"";"";"";"MADRID";"MADRID";"28013";"SOL";"CENTRO";"440530";"4474474";"40.416887979993966";"-3.7022740027977377";"";"";"";"/contenido/entidadesYorganismos/MonumentosEdificiosArtisticos"; 
2124;"Real Academia de Ciencias Morales y Politicas";"Ubicada en una de las pocas casas-palacio del siglo  XV  conservadas en Madrid. La torre y la casa fueron mandadas construir por alvaro de Lujan antes de 1471. Su planta, de forma irregular, se distribuye en torno a un gran patio central y tiene triple fachada. El edificio ha sufrido multiples reformas, una de las cuales fue para la instalacion de la Real Academia, llevada a cabo en 1858.";"";"Actividades: disertaciones privadas para los academicos. Actos publicos cuando ingresa un nuevo academico.  Biblioteca: acceso restringido a academicos e investigadores.";"Metro: Sol (lineas 1, 2, 3), opera (lineas 2, 5)  Bus: 3, 31, 50, 65  Renfe: Sol";"Mas informacion en la  pagina web de Monumenta Madrid";"0";"http://www.madrid.es/sites/v/index.jsp?vgnextchannel=9e4c43db40317010VgnVCM100000dc0ca8c0RCRD&vgnextoid=f35bff632081c010VgnVCM1000000b205a0aRCRD";"DE LA VILLA";"PLAZA";"V";"2";"";"";"";"";"MADRID";"MADRID";"28005";"PALACIO";"CENTRO";"439854";"4474287";"40.4151547271264";"-3.71022377531515";"915 481 330";"";"secretaria@racmyp.es";"/contenido/entidadesYorganismos/MonumentosEdificiosArtisticos"; 
2128;"Real Academia de Jurisprudencia y Legislacion";"";"";"Salon de actos  Biblioteca  Archivo  Sala de conferencias   Actividades: conferencias, seminarios y coloquios";"Metro: Banco de Espana (linea 2)  Bus: 1, 2, 5, 9, 10, 14, 15, 20, 27, 34, 37, 45, 46, 51, 52, 53, 74, 146, 150";"Descripcion monumental   Tiene su sede en un palacio construido en el ano 1798 por el arquitecto Manuel Martin Rodriguez (1740-1823), sobrino y discipulo de Ventura Rodriguez, y del que se conservan otros excelentes edificios en Madrid, como el convento y la iglesia de las Reparadoras, el palacio de Altamira y el Museo Romantico. La sede de la Real Academia de Jurisprudencia ha sido declarada Monumento de Interes Cultural por Real Decreto de 27 de febrero de 1998. El edificio fue construido para almacen de la Real Fabrica de Vidrio de la Granja, aunque en el llegaron a fabricarse lentes opticas para anteojos e instrumentos de precision.  Despues de ese destino inicial, el palacio ha tenido multiples usos y ha sido objeto de algunas remodelaciones: fue sede de la primera exposicion de la Industria Espanola en 1828, mas tarde fue compartido por la Escuela de Sordomudos y Ciegos y la Escuela de Ingenieros de Caminos, despues paso a ser Conservatorio de Artes, Direccion General de las Clases Pasivas y Caja General de Depositos.";"0";"http://www.madrid.es/sites/v/index.jsp?vgnextchannel=9e4c43db40317010VgnVCM100000dc0ca8c0RCRD&vgnextoid=866bff632081c010VgnVCM1000000b205a0aRCRD";"MARQUeS DE CUBAS";"CALLE";"V";"13";"";"";"";"";"MADRID";"MADRID";"28014";"CORTES";"CENTRO";"441105";"4474537";"40.41749648159225";"-3.6955027540085243";"915 222 069";"915 234  021";"secretaria@rajyl.es";"/contenido/entidadesYorganismos/MonumentosEdificiosArtisticos"; 
2127;"Real Academia Espanola de Historia";"";"";"";"Metro: Anton Martin (linea 1)  Bus: 6, 26, 32";"Descripcion monumental   Construido por Juan de Villanueva en 1788 como Casa de Nuevo Rezado de los monjes jeronimos. De estilo neoclasico con gran sencillez y reduccion de elementos. Solo destaca la portada principal senalada por la entrada remarcada y el balcon en saledizo, con el unico adorno de la parrilla de San Lorenzo. Recientemente ha sido restaurado por Chueca Goitia.";"0";"http://www.madrid.es/sites/v/index.jsp?vgnextchannel=9e4c43db40317010VgnVCM100000dc0ca8c0RCRD&vgnextoid=197bff632081c010VgnVCM1000000b205a0aRCRD";"DE LEoN";"CALLE";"V";"21";"";"";"";"";"MADRID";"MADRID";"28014";"CORTES";"CENTRO";"440804";"4474092";"40.41346631071615";"-3.699008959181709";"914 290 611 ";"913 694 636";"secretaria@rah.es";"/contenido/entidadesYorganismos/MonumentosEdificiosArtisticos"; 
2126;"Real Academia Nacional de Farmacia";"";"";"Museo de farmacia  Biblioteca";"Metro: Chueca (linea 5), Tribunal (linea 1 y 10)  Bus: 3";"Acceso a la Biblioteca : hay que presentar el  DNI  acompanado de una carta de presentacion de un Academico de Numero o bien de un Catedratico de Universidad y cumplimentar los impresos correspondientes.";"0";"http://www.madrid.es/sites/v/index.jsp?vgnextchannel=9e4c43db40317010VgnVCM100000dc0ca8c0RCRD&vgnextoid=3e9bff632081c010VgnVCM1000000b205a0aRCRD";"FARMACIA";"CALLE";"V";"9";"";"";"";"TAMBIeN NuMERO 11";"MADRID";"MADRID";"28004";"JUSTICIA";"CENTRO";"440754";"4475258";"40.423966629698484";"-3.6997070566405665";"915 310 307  / 915 223 147";"915 310 306";"secretaria@ranf.com";"/contenido/entidadesYorganismos/MonumentosEdificiosArtisticos"; 
3359;"Real Basilica San Francisco el Grande";"Conjunto conventual que sustituyo al monasterio franciscano medieval, construido por Francisco de las Cabezas entre 1761 y 1768, que fue relevado por Antonio Polo y que concluye Francisco Sabatini en 1784 donde se exponen colecciones de pinturas de los siglos  XVII  al  XIX.";"Museo:     De martes a viernes de 10:30 a 12:30 y de 16 a 18 horas  Sabados de 10:30 a 12:30 y de 16 a 18 horas (si no se ofician actos religiosos).  Julio, agosto y septiembre: de martes a domingo de 10:30 a 12:30 y de 17 a 19 horas.";"";"Metro: La Latina (linea 5) , Puerta de Toledo (linea 5)  Bus:  3, 17, 18, 23, 31, 35, 36, 41, 50, 60, 65, 148, 749, C1, C2";"";"0";"http://www.madrid.es/sites/v/index.jsp?vgnextchannel=9e4c43db40317010VgnVCM100000dc0ca8c0RCRD&vgnextoid=ef8d0713fb71c010VgnVCM1000000b205a0aRCRD";"SAN BUENAVENTURA";"CALLE";"V";"1";"";"";"";"";"MADRID";"MADRID";"28005";"PALACIO";"CENTRO";"439487";"4473811";"40.41084005024222";"-3.714503845728281";"913 653 800 ";"";"";"/contenido/entidadesYorganismos/MonumentosEdificiosArtisticos"; 
6070;"Real Colegio Santa Isabel - La Asuncion";"";"";"Horario ampliado - Comedor";"Metro: Atocha , Anton Martin   Bus: 6 , 19 , 26 , 27 , 32 , 34 , 37 , 41 , 45 , 119 , C   Renfe: Atocha";"ENSEnANZA: Educacion Infantil (segundo ciclo) - Primaria - ESO - BACHILLERATO (Humanidades y C. Sociales - Ciencias y Tecnologia) - Ensenanza biling&uuml;e";"0";"http://www.madrid.es/sites/v/index.jsp?vgnextchannel=9e4c43db40317010VgnVCM100000dc0ca8c0RCRD&vgnextoid=b2b9f3216571c010VgnVCM1000000b205a0aRCRD";"SANTA ISABEL";"CALLE";"V";"46";"";"";"";"";"MADRID";"MADRID";"28012";"EMBAJADORES";"CENTRO";"441006";"4473664";"40.40962511552305";"-3.6965767139076444";"915 273 183 - 915 273 181";"915 289 845";"";"/contenido/entidadesYorganismos/MonumentosEdificiosArtisticos"; 
2087;"Real Fabrica de Tapices";"";"De lunes a viernes de 10 a 14 horas.  Cerrado: sabados, domingos, festivos, Semana Santa y agosto.";"";"Metro: Menendez Pelayo (linea 1)  Bus: 10, 14, 26, 32, C";"";"0";"http://www.madrid.es/sites/v/index.jsp?vgnextchannel=9e4c43db40317010VgnVCM100000dc0ca8c0RCRD&vgnextoid=53cbff632081c010VgnVCM1000000b205a0aRCRD";"FUENTERRABIA";"CALLE";"V";"2";"";"";"";"";"MADRID";"MADRID";"28014";"PACIFICO";"RETIRO";"442197";"4473262";"40.406087329011655";"-3.682515969574079";"914 340 550";"915 513 409";"informacion@realfabricadetapices.com";"/contenido/entidadesYorganismos/MonumentosEdificiosArtisticos"; 
6113673;"Real Jardin Botanico";"Centro de investigacion del  CSIC  que alberga cuatro terrazas con plantas de America, Europa y el Pacifico, asi como una coleccion de bonsais.";"El Jardin esta abierto al publico todos los dias del ano, excepto los dias de Navidad y Ano Nuevo.   Enero y febrero: de 10 a 18 horas  Marzo: de 10 a 19 horas  Abril: de 10 a 20 horas  De mayo a agosto de 10 a 21 horas  Septiembre: de 10 a 20 horas  Octubre: de 10 a 19 horas  Noviembre y diciembre: de 10 a 18 horas";"";"Metro: Atocha (linea 1)  Bus: 10, 14, 19, 24, 26, 27, 32, 34, 45, 57, 140, Circular  RENFE: Atocha";"";"0";"http://www.madrid.es/sites/v/index.jsp?vgnextchannel=9e4c43db40317010VgnVCM100000dc0ca8c0RCRD&vgnextoid=e9234477786b0310VgnVCM2000000c205a0aRCRD";"MURILLO";"PLAZA";"V";"2";"";"";"";"";"MADRID";"MADRID";"28014";"LOS JERONIMOS";"RETIRO";"441395";"4473967";"40.41238214985831";"-3.692032097926277";"";"";"";"/contenido/entidadesYorganismos/MonumentosEdificiosArtisticos"; 
3349;"Real Monasterio de la Encarnacion";"Edificio construido por Juan Gomez de Mora de 1611 a 1616 como monasterio anejo al Alcazar Real, modelo de lo que se ha dado en llamar barroco madrileno. Cuenta con la reliquia de San Pantaleon.";"De martes a sabado: de 10 a 14 horas y de 16 a 18:30 horas  Domingos y festivos: de 10 a 15 horas. Tardes cerrado  Cierre taquillas: una hora antes  Cerrado todos los lunes del ano";"";"Metro:  opera (lineas 2, 5 y Ramal opera Principe Pio), Plaza de Espana (lineas 3, 10)  Bus:  1, 2, 3, 25, 39, 44, 46, 74, 75, 133, 138, 147, 148, C1, C2";"";"1";"http://www.madrid.es/sites/v/index.jsp?vgnextchannel=9e4c43db40317010VgnVCM100000dc0ca8c0RCRD&vgnextoid=72ad0713fb71c010VgnVCM1000000b205a0aRCRD";"ENCARNACION";"PLAZA";"V";"1";"";"";"";"";"MADRID";"MADRID";"28013";"PALACIO";"CENTRO";"439744";"4474790";"40.41967800877382";"-3.711567962866152";"914 548 700 (Informacion general)";"";"info@patrimonionacional.es";"/contenido/entidadesYorganismos/MonumentosEdificiosArtisticos"; 
4707297;"Real Monasterio de Santa Isabel";"El Real Monasterio de Santa Isabel esta situado en Madrid, dentro de la ciudad historica, en una gran manzana, proxima a Atocha.  Santa Isabel agrupa dos fundaciones, un colegio de ninas, establecido por Felipe  II , y un convento de clausura de monjas agustinas recoletas, fundado por la esposa de Felipe  III , dona Margarita de Austria.  La arquitectura de la iglesia se debe a Gomez de Mora, de mediados del siglo  XVIII . En la clausura se conservan numerosas obras pictoricas de los siglos  XVII  y  XVIII .";"El acceso al templo solo es posible en horario de culto y por la fachada principal.";"";"Metro: Atocha (linea 1)  Bus: 6, 19, 26, 27, 32, 34, 45, 59, 85, 86, C1, E1  Renfe: Atocha";"";"0";"http://www.madrid.es/sites/v/index.jsp?vgnextchannel=9e4c43db40317010VgnVCM100000dc0ca8c0RCRD&vgnextoid=545b544a249c6110VgnVCM1000000b205a0aRCRD";"SANTA ISABEL";"CALLE";"V";"48";"";"";"";"";"MADRID";"MADRID";"28012";"EMBAJADORES";"CENTRO";"440765";"4473944";"40.41213027498252";"-3.6994547941964946";"914 548 700 (Informacion general)";"";"info@patrimonionacional.es";"/contenido/entidadesYorganismos/MonumentosEdificiosArtisticos"; 
3360;"Real Oratorio del Caballero de Gracia";"Construido por Juan de Villanueva entre 1786 y 1795 de planta basilical y en un sentir muy cercano al de las iglesias venecianas de Palladio. La fachada es de Custodio Moreno.  Entre 1976 y 1981 el arquitecto Fernando Chueca Goitia emprendio un proyecto de restauracion  con polemicos resultados. Los trabajos se interrumpieron durante largos anos; convocandose finalmente un concurso de arquitectura que fue ganado en 1987 por Javier Feduchi Benlliure.";"";"";"Metro: Gran Via (lineas 1 y 5), Sevilla (linea 2), Sol (lineas 1, 2, 3)  Bus: 1, 2, 3, 46, 74, 146";"";"0";"http://www.madrid.es/sites/v/index.jsp?vgnextchannel=9e4c43db40317010VgnVCM100000dc0ca8c0RCRD&vgnextoid=ef153d232e91f010VgnVCM1000000b205a0aRCRD";"CABALLERO DE GRACIA";"CALLE";"V";"5";"";"";"";"";"MADRID";"MADRID";"28013";"SOL";"CENTRO";"440660";"4474767";"40.41953675995833";"-3.700769178078419";"915 326 937 / 915 240 664";"";"";"/contenido/entidadesYorganismos/MonumentosEdificiosArtisticos"; 
